333,Tick v. Quintus Corporation (3:00-cv-04381),"District Court, N.D. California","Feb. 4, 2022, 2:25 p.m.",Vaughn R. Walker,"Tick v. Quintus Corporation, 3:00-cv-04381, (N.D. Cal.)","Nov. 22, 2000","Dec. 5, 2006",,https://www.courtlistener.com/docket/5777596/19/tick-v-quintus-corporation/,15:78m(a) Securities Exchange Act,Securities/Commodities,Federal question,"Dec. 5, 2006",
334,Zanowiak v. Quintus Corporation (3:00-cv-04390),"District Court, N.D. California","Feb. 4, 2022, 2:25 p.m.",Vaughn R. Walker,"Zanowiak v. Quintus Corporation, 3:00-cv-04390, (N.D. Cal.)","Nov. 22, 2000","Dec. 5, 2006",,https://www.courtlistener.com/docket/5777598/13/zanowiak-v-quintus-corporation/,15:78m(a) Securities Exchange Act,Securities/Commodities,Federal question,"Dec. 5, 2006",
335,Miller v. Quintus Corporation (3:00-cv-04392),"District Court, N.D. California","Feb. 4, 2022, 2:25 p.m.",Vaughn R. Walker,"Miller v. Quintus Corporation, 3:00-cv-04392, (N.D. Cal.)","Nov. 22, 2000","Dec. 5, 2006",,https://www.courtlistener.com/docket/5777600/16/miller-v-quintus-corporation/,15:78m(a) Securities Exchange Act,Securities/Commodities,Federal question,"Dec. 5, 2006",
336,Tan v. Quintus Corporation (3:00-cv-04504),"District Court, N.D. California","Feb. 4, 2022, 2:25 p.m.",Vaughn R. Walker,"Tan v. Quintus Corporation, 3:00-cv-04504, (N.D. Cal.)","Dec. 1, 2000","Dec. 5, 2006",,https://www.courtlistener.com/docket/5777602/20/tan-v-quintus-corporation/,15:78m(a) Securities Exchange Act,Securities/Commodities,Federal question,"Dec. 5, 2006",
337,Civic v. Quintus Corporation (3:00-cv-04276),"District Court, N.D. California","Feb. 4, 2022, 2:25 p.m.",Vaughn R. Walker,"Civic v. Quintus Corporation, 3:00-cv-04276, (N.D. Cal.)","Nov. 16, 2000","Dec. 5, 2006",,https://www.courtlistener.com/docket/5777588/21/civic-v-quintus-corporation/,15:78m(a) Securities Exchange Act,Securities/Commodities,Federal question,"Dec. 5, 2006",
338,Yu v. Quintus Corporation (3:00-cv-04528),"District Court, N.D. California","Feb. 4, 2022, 2:25 p.m.",Vaughn R. Walker,"Yu v. Quintus Corporation, 3:00-cv-04528, (N.D. Cal.)","Dec. 4, 2000","Dec. 5, 2006",,https://www.courtlistener.com/docket/5777605/14/yu-v-quintus-corporation/,15:78m(a) Securities Exchange Act,Securities/Commodities,Federal question,"Dec. 5, 2006",
339,Weiss v. Quintus Corporation (3:00-cv-04264),"District Court, N.D. California","Feb. 4, 2022, 2:25 p.m.",Vaughn R. Walker,"Weiss v. Quintus Corporation, 3:00-cv-04264, (N.D. Cal.)","Nov. 15, 2000","Dec. 5, 2006",Both,,15:78m(a) Securities Exchange Act,850 Securities/Commodities,Federal Question,"Dec. 5, 2006",
340,"Blizzard Entertainment, Inc. v. Lilith Games (Shanghai) Co. Ltd. (3:15-cv-04084)","District Court, N.D. California","Nov. 11, 2021, 2:38 p.m.",Charles R. Breyer,"Blizzard Entertainment, Inc. v. Lilith Games (Shanghai) Co. Ltd., 3:15-cv-04084, (N.D. Cal.)","Sept. 8, 2015","Dec. 20, 2018",Both,https://www.courtlistener.com/docket/4182164/1/blizzard-entertainment-inc-v-lilith-games-shanghai-co-ltd/,17:501 Copyright Infringement,820 Copyright,Federal Question,"Dec. 19, 2018",Jacquelyn Scott Corley
341,O2 Media LLC v. Narrative Science Inc. (1:15-cv-05129),"District Court, N.D. Illinois","Feb. 4, 2022, 5:06 p.m.",John Joseph Tharp Jr.,"O2 Media LLC v. Narrative Science Inc., 1:15-cv-05129, (N.D. Ill.)","June 10, 2015","Jan. 3, 2017",Both,https://www.courtlistener.com/docket/4262951/1/o2-media-llc-v-narrative-science-inc/,35:271 Patent Infringement,830 Patent,Federal Question,"Feb. 25, 2016",
342,"Sabatini v. Amyris, Inc. (1:20-cv-01013)","District Court, D. Delaware","Nov. 7, 2021, 6:23 p.m.",Leonard Philip Stark,"Sabatini v. Amyris, Inc., 1:20-cv-01013, (D. Del.)","July 28, 2020","Oct. 8, 2020",Plaintiff,https://www.courtlistener.com/docket/17391067/1/sabatini-v-amyris-inc/,15:78m(a) Securities Exchange Act,850 Securities/Commodities,Federal Question,"Oct. 8, 2020",
343,United States v. Gage (1:19-cr-00705),"District Court, N.D. Ohio","Nov. 12, 2021, 5:22 a.m.",Solomon Oliver Jr.,"United States v. Gage, 1:19-cr-00705, (N.D. Ohio)","Nov. 7, 2019","Sept. 29, 2021",,,,,,"Sept. 29, 2021",
344,Gonzalez v. InfoStream Group Inc. (2:14-cv-00906),"District Court, E.D. Texas","Feb. 4, 2022, 5:10 p.m.",James Rodney Gilstrap,"Gonzalez v. InfoStream Group Inc., 2:14-cv-00906, (E.D. Tex.)","Sept. 23, 2014","Sept. 27, 2017",Defendant,https://www.courtlistener.com/docket/4387083/1/gonzalez-v-infostream-group-inc/,35:271 Patent Infringement,830 Patent,Federal Question,"Oct. 5, 2016",
345,"Chamorro v. Amyris, Inc. (1:20-cv-06077)","District Court, S.D. New York","Nov. 15, 2021, 5:26 a.m.",Lewis J. Liman,"Chamorro v. Amyris, Inc., 1:20-cv-06077, (S.D.N.Y.)","Aug. 4, 2020","May 12, 2021",Both,https://www.courtlistener.com/docket/17413732/1/chamorro-v-amyris-inc/,15:78m(a) Securities Exchange Act,850 Securities/Commodities,Federal Question,"May 12, 2021",
346,"Synopsys, Inc. v. Gyrfalcon Technology Inc. (3:18-cv-06361)","District Court, N.D. California","Nov. 12, 2021, 7:30 p.m.",James Donato,"Synopsys, Inc. v. Gyrfalcon Technology Inc., 3:18-cv-06361, (N.D. Cal.)","Oct. 17, 2018","Feb. 14, 2019",Plaintiff,https://www.courtlistener.com/docket/8048078/1/synopsys-inc-v-gyrfalcon-technology-inc/,17:101 Copyright Infringement,Copyright,Federal Question,"Jan. 15, 2019",
347,"Janssen Biotech, Inc. v. Celltrion Healthcare Co., Ltd. (1:17-cv-11008)","District Court, D. Massachusetts","Feb. 4, 2022, 6:12 p.m.",Mark Lawrence Wolf,"Janssen Biotech, Inc. v. Celltrion Healthcare Co., Ltd., 1:17-cv-11008, (D. Mass.)","May 31, 2017","April 13, 2020",Both,,35:271 Patent Infringement,830 Patent,Federal Question,"July 31, 2018",
348,K.P. v. City of Chicago SD 299 (1:14-cv-07296),"District Court, N.D. Illinois","Feb. 4, 2022, 4:59 p.m.",Ronald A. Guzman,"K.P. v. City of Chicago SD 299, 1:14-cv-07296, (N.D. Ill.)","Sept. 19, 2014","March 13, 2015",,https://www.courtlistener.com/docket/5619015/21/kp-v-city-of-chicago-sd-299/,20:1401 Education: Handicapped Child Act,Civil Rights: Education,Federal question,"March 13, 2015",
349,Moudgil v. Fujifilm North America Corp. (1:20-cv-04732),"District Court, S.D. New York","Nov. 15, 2021, 10:31 p.m.",Mary Kay Vyskocil,"Moudgil v. Fujifilm North America Corp., 1:20-cv-04732, (S.D.N.Y.)","June 19, 2020","Feb. 2, 2021",Plaintiff,https://www.courtlistener.com/docket/17268110/1/moudgil-v-fujifilm-north-america-corp/,29:623 Job Discrimination (Age),Civil Rights: Jobs,Federal Question,"Jan. 7, 2021",
350,Bruhn Farms Joint Venture v. Fireman's Fund Insurance Company (5:13-cv-04106),"District Court, N.D. Iowa","Feb. 4, 2022, 5:11 p.m.",CJ Williams-M,"Bruhn Farms Joint Venture v. Fireman's Fund Insurance Company, 5:13-cv-04106, (N.D. Iowa)","Nov. 4, 2013","Feb. 25, 2019",Plaintiff,,28:1441 Petition for Removal- Contract Default,110 Insurance,Federal Question,"March 13, 2017",
351,"Pearson Education, Inc. v. Anaya Inc. (1:08-cv-07176)","District Court, S.D. New York","Feb. 4, 2022, 5:26 p.m.",Naomi Reice Buchwald,"Pearson Education, Inc. v. Anaya Inc., 1:08-cv-07176, (S.D.N.Y.)","Aug. 12, 2008","Nov. 7, 2008",,https://www.courtlistener.com/docket/4345349/1/pearson-education-inc-v-anaya-inc/,,820 Copyright,Federal question,"Oct. 20, 2008",
352,Maia v. Luo (1:17-cv-09796),"District Court, S.D. New York","Feb. 4, 2022, 6:13 p.m.",Jesse Matthew Furman,"Maia v. Luo, 1:17-cv-09796, (S.D.N.Y.)","Dec. 14, 2017","June 21, 2021",Plaintiff,https://www.courtlistener.com/docket/13445785/1/maia-v-luo/,15:77 Securities Fraud,850 Securities/Commodities,Federal Question,"Aug. 13, 2020",
353,Hajim v. Endemol Shine UK (1:19-cv-06852),"District Court, N.D. Illinois","Nov. 13, 2021, 12:39 a.m.",Harry Daniel Leinenweber,"Hajim v. Endemol Shine UK, 1:19-cv-06852, (N.D. Ill.)","Oct. 16, 2019","July 6, 2021",Both,https://www.courtlistener.com/docket/16344463/1/hajim-v-endemol-shine-uk/,17:101 Copyright Infringement,820 Copyright,Federal Question,"June 22, 2021",
354,Anthony C. Lustig v. AzGen Scientific Holdings PLC (4:18-cv-07503-HSG),"District Court, N.D. California","Nov. 17, 2021, 7:49 a.m.",Haywood Stirling Gilliam Jr.,"Anthony C. Lustig v. AzGen Scientific Holdings PLC, 4:18-cv-07503-HSG, (N.D. Cal.)","Dec. 13, 2018","Nov. 12, 2021",Plaintiff,,28:1332 Diversity-Breach of Contract,Contract: Other,Diversity,"June 3, 2020",Joseph Spero
355,"One Trade Ltd, LLC v. Glenn (1:20-cv-22950)","District Court, S.D. Florida","Oct. 24, 2023, 4:52 p.m.",Marcia G. Cooke,"One Trade Ltd, LLC v. Glenn, 1:20-cv-22950, (S.D. Fla.)","July 16, 2020","Oct. 24, 2023",None,https://www.courtlistener.com/docket/17357672/1/one-trade-ltd-llc-v-glenn/,28:1332 Diversity-Contract Dispute,190 Contract: Other,Diversity,"Jan. 30, 2021",Jonathan Goodman
356,"Strike 3 Holdings, LLC v. John Doe (5:18-cv-03082)","District Court, N.D. California","Nov. 12, 2021, 6:03 p.m.",Nathanael M. Cousins,"Strike 3 Holdings, LLC v. John Doe, 5:18-cv-03082, (N.D. Cal.)","May 23, 2018","April 22, 2019",Both,,17:101 Copyright Infringement,820 Copyright,Federal Question,"April 2, 2019",
357,Odish v. Morgenthaler Ventures (2:13-cv-14026),"District Court, E.D. Michigan","Feb. 4, 2022, 5:59 p.m.",Laurie Jill Michelson,"Odish v. Morgenthaler Ventures, 2:13-cv-14026, (E.D. Mich.)","Sept. 19, 2013","June 30, 2019",Plaintiff,https://www.courtlistener.com/docket/4292338/1/odish-v-morgenthaler-ventures/,12:22 Securities Fraud,850 Securities/Commodities,Federal Question,"March 11, 2015",Anthony P. Patti
358,"Sullivan v. Pfizer, Inc. (3:14-cv-01374)","District Court, D. Connecticut","Feb. 4, 2022, 6:02 p.m.",Michael Peter Shea,"Sullivan v. Pfizer, Inc., 3:14-cv-01374, (D. Conn.)","Sept. 19, 2014","March 9, 2016",,,28:1332 Diversity-Personal Injury,Personal Inj. Prod. Liability,Diversity of citizenship,"March 9, 2016",
359,Jose Antonio Franco-Gonzalez v. Janet Napolitano (2:10-cv-02211),"District Court, C.D. California","Sept. 18, 2023, 10:21 a.m.",Dolly Maizie Gee,"Jose Antonio Franco-Gonzalez v. Janet Napolitano, 2:10-cv-02211, (C.D. Cal.)","March 26, 2010","July 28, 2023",None,https://www.courtlistener.com/docket/4542512/1/jose-antonio-franco-gonzalez-v-janet-napolitano/,28:2241 Petition for Writ of Habeas Corpus (federal),890 Other Statutory Actions,U.S. Government Defendant,"March 16, 2016",Alicia G. Rosenberg
360,"WHITFIELD v. NET ELEMENT, INC. (2:21-cv-03615)","District Court, E.D. Pennsylvania","March 3, 2022, 9:06 p.m.",Gerald John Pappert,"WHITFIELD v. NET ELEMENT, INC., 2:21-cv-03615, (E.D. Pa.)","Aug. 13, 2021","Sept. 9, 2021",Plaintiff,https://www.courtlistener.com/docket/60180785/1/whitfield-v-net-element-inc/,12:22 Securities Fraud,850 Other Statutes: Securities/Commodities,Federal Question,"Sept. 9, 2021",
361,"RapidDeploy, Inc. v. Kraus Associates, Inc. (3:19-cv-00668)","District Court, M.D. Florida","Feb. 23, 2022, 2:13 p.m.",Timothy J. Corrigan,"RapidDeploy, Inc. v. Kraus Associates, Inc., 3:19-cv-00668, (M.D. Fla.)","June 6, 2019","Oct. 4, 2019",,https://www.courtlistener.com/docket/15739499/1/rapiddeploy-inc-v-kraus-associates-inc/,,830 Patent,Federal question,"Oct. 4, 2019",Joel B. Toomey
362,Koninklijke Philips N.V. v. Acer Inc. (1:15-cv-01170),"District Court, D. Delaware","July 1, 2022, 10:04 p.m.",Gregory Moneta Sleet,"Koninklijke Philips N.V. v. Acer Inc., 1:15-cv-01170, (D. Del.)","Dec. 18, 2015","April 4, 2018",Plaintiff,,35:271 Patent Infringement,830 Patent,Federal Question,"March 27, 2018",
363,"ZapFraud, Inc. v. Barracuda Networks, Inc. (1:19-cv-01687)","District Court, D. Delaware","July 1, 2022, 10:04 p.m.",Colm Felix Connolly,"ZapFraud, Inc. v. Barracuda Networks, Inc., 1:19-cv-01687, (D. Del.)","Sept. 10, 2019","Oct. 4, 2021",Plaintiff,,35:271 Patent Infringement,830 Patent,Federal Question,"Oct. 4, 2021",Christopher J. Burke
364,"FiscalNote, Inc. v. Germain (1:20-cv-01579)","District Court, E.D. Virginia","April 24, 2022, 6:54 a.m.",Leonie M. Brinkema,"FiscalNote, Inc. v. Germain, 1:20-cv-01579, (E.D. Va.)","Dec. 22, 2020","Oct. 19, 2021",None,,18:1836(b) - Civil Action to Protect Trade Secrets,880 Defend Trade Secrets Act (of 2016),Federal Question,"Oct. 19, 2021",Michael S. Nachmanoff
365,"Spider Labs, Ltd. v. Doe (1:20-cv-05457)","District Court, S.D. New York","May 15, 2022, 7:39 a.m.",Loretta A. Preska,"Spider Labs, Ltd. v. Doe, 1:20-cv-05457, (S.D.N.Y.)","July 15, 2020","May 11, 2021",Plaintiff,https://www.courtlistener.com/docket/17354178/1/spider-labs-ltd-v-doe/,"28:1332lb Diversity-Libel, Assault, Slander",320 Assault Libel & Slander,Diversity,"May 11, 2021",
366,"NAACP LEGAL DEFENSE & EDUCATIONAL FUND, INC. v. BARR (1:20-cv-01132)","District Court, District of Columbia","June 21, 2022, 6:52 a.m.",John D. Bates,"NAACP LEGAL DEFENSE & EDUCATIONAL FUND, INC. v. BARR, 1:20-cv-01132, (D.D.C.)","April 30, 2020","Feb. 25, 2022",None,https://www.courtlistener.com/docket/17117868/1/naacp-legal-defense-educational-fund-inc-v-barr/,28:1361 Petition for Writ of Mandamus,890 Other Statutory Actions,U.S. Government Defendant,"March 23, 2022",
367,Freeman v. JP Morgan Chase Bank and Co. (1:20-cv-00087),"District Court, D. Rhode Island","Aug. 16, 2022, 11:15 a.m.",Mary Susan McElroy,"Freeman v. JP Morgan Chase Bank and Co., 1:20-cv-00087, (D.R.I.)","Feb. 19, 2020","Aug. 16, 2022",,https://www.courtlistener.com/docket/16864329/1/freeman-v-jp-morgan-chase-bank-and-co/,28:1332 Diversity-Fraud,Real Property: Other,Diversity of citizenship,"March 30, 2022",Patricia A. Sullivan
368,"Kent v. Varian Medical Systems, Inc. (1:20-cv-01178)","District Court, D. Delaware","April 18, 2022, 10:45 p.m.",Richard Gibson Andrews,"Kent v. Varian Medical Systems, Inc., 1:20-cv-01178, (D. Del.)","Sept. 3, 2020","Oct. 6, 2020",Plaintiff,https://www.courtlistener.com/docket/18409510/1/kent-v-varian-medical-systems-inc/,15:78m(a) Securities Exchange Act,850 Securities/Commodities,Federal Question,"Oct. 6, 2020",
369,Kent v. Churchill Capital Corp III (1:20-cv-01068),"District Court, D. Delaware","June 16, 2022, 6:26 p.m.",Maryellen Noreika,"Kent v. Churchill Capital Corp III, 1:20-cv-01068, (D. Del.)","Aug. 13, 2020","Oct. 8, 2020",Plaintiff,https://www.courtlistener.com/docket/17444729/1/kent-v-churchill-capital-corp-iii/,15:78m(a) Securities Exchange Act,850 Securities/Commodities,Federal Question,"Oct. 8, 2020",
370,"Smith v. Automatic Data Processing, Inc. (8:20-cv-02936)","District Court, M.D. Florida","May 15, 2022, 9:33 a.m.",Charlene Vanessa Edwards Honeywell,"Smith v. Automatic Data Processing, Inc., 8:20-cv-02936, (M.D. Fla.)","Dec. 9, 2020","Nov. 3, 2021",Plaintiff,,"28:1441 Notice of Removal-Libel, Assault, Slander",Assault Libel & Slander,Federal Question,"Oct. 26, 2021",Christopher P. Tuite
371,"Atkinson v. Facebook, Inc. (3:19-cv-01785)","District Court, D. Connecticut","May 22, 2022, 8:05 a.m.",Janet C. Hall,"Atkinson v. Facebook, Inc., 3:19-cv-01785, (D. Conn.)","Nov. 12, 2019","Aug. 11, 2020",Plaintiff,https://www.courtlistener.com/docket/16456285/1/atkinson-v-facebook-inc/,42:1981 Civil Rights,440 Civil Rights: Other,Federal Question,"July 27, 2020",
372,Ayyadurai v. Galvin (1:20-cv-11889),"District Court, D. Massachusetts","Aug. 30, 2023, 7:55 p.m.",Mark Lawrence Wolf,"Ayyadurai v. Galvin, 1:20-cv-11889, (D. Mass.)","Oct. 20, 2020","Aug. 10, 2021",Plaintiff,,42:1983 Civil Rights Act,440 Civil Rights: Other,U.S. Government Defendant,"Aug. 11, 2021",
373,Arizona Board of Regents v. Doe (2:20-cv-01638),"District Court, D. Arizona","Sept. 4, 2022, 3:07 a.m.",Dominic William Lanza,"Arizona Board of Regents v. Doe, 2:20-cv-01638, (D. Ariz.)","Aug. 20, 2020","June 6, 2022",Both,https://www.courtlistener.com/docket/17465442/1/arizona-board-of-regents-v-doe/,15:1114 Trademark Infringement,840 Property Rights: Trademark,Federal Question,"Aug. 17, 2021",
374,Chavez v. Amazon.com Inc (2:21-cv-00007),"District Court, W.D. Washington","Sept. 4, 2022, 5:44 p.m.",Barbara Jacobs Rothstein,"Chavez v. Amazon.com Inc, 2:21-cv-00007, (W.D. Wash.)","Jan. 4, 2021","March 15, 2022",Plaintiff,https://www.courtlistener.com/docket/29081170/1/chavez-v-amazoncom-inc/,42:12112 Americans with Disabilities Act,445 Civil Rights: Americans with Disabilities - Employment,Federal Question,"March 15, 2022",
375,United States v. Caruso (2:20-cr-00165),"District Court, D. Arizona","Nov. 20, 2023, 2:21 p.m.",John Joseph Tuchi,"United States v. Caruso, 2:20-cr-00165, (D. Ariz.)","Feb. 18, 2020","Nov. 20, 2023",,,,,,,
376,"Miller v. Facebook, Inc. (1:21-cv-05830)","District Court, N.D. Illinois","Aug. 15, 2022, 6:15 p.m.",Manish Suresh Shah,"Miller v. Facebook, Inc., 1:21-cv-05830, (N.D. Ill.)","Nov. 1, 2021","April 5, 2022",None,https://www.courtlistener.com/docket/60698007/1/miller-v-facebook-inc/,42:1983 Prisoner Civil Rights,550 Prisoner: Civil Rights,Federal Question,"April 5, 2022",
377,"First Look Institute, Inc. v. U. S. Marine Corps (2:21-cv-05087)","District Court, C.D. California","Aug. 26, 2022, 6:03 a.m.",Mark Christopher Scarsi,"First Look Institute, Inc. v. U. S. Marine Corps, 2:21-cv-05087, (C.D. Cal.)","June 22, 2021","June 13, 2022",None,,05:552 Freedom of Information Act,Freedom of Information Act,U.S. Government Defendant,"June 13, 2022",Rozella A. Oliver
378,"Havas Worldwide New York, Inc. v. Crossborder Transactions LLC (7:21-cv-10227)","District Court, S.D. New York","Aug. 19, 2022, 1:17 p.m.",Vincent Louis Briccetti,"Havas Worldwide New York, Inc. v. Crossborder Transactions LLC, 7:21-cv-10227, (S.D.N.Y.)","Dec. 1, 2021","April 4, 2022",Plaintiff,https://www.courtlistener.com/docket/61588253/1/havas-worldwide-new-york-inc-v-crossborder-transactions-llc/,17:101 Copyright Infringement,Copyright,Federal Question,"March 4, 2022",
379,"North American Capacity Insurance Company v. Lemonade, Inc. (1:21-cv-08153)","District Court, S.D. New York","Nov. 22, 2022, 12:10 p.m.",John George Koeltl,"North American Capacity Insurance Company v. Lemonade, Inc., 1:21-cv-08153, (S.D.N.Y.)","Oct. 1, 2021","Nov. 22, 2022",None,https://www.courtlistener.com/docket/60605474/1/north-american-capacity-insurance-company-v-lemonade-inc/,28:1332 Diversity Action,Insurance,Diversity,,
380,"Palomar Technologies, Inc. v. MRSI Systems, LLC (1:18-cv-10236)","District Court, D. Massachusetts","Oct. 11, 2022, 2:40 p.m.",F. Dennis Saylor IV,"Palomar Technologies, Inc. v. MRSI Systems, LLC, 1:18-cv-10236, (D. Mass.)","Feb. 6, 2018","Jan. 7, 2021",Both,,28:1338 Patent Infringement,830 Patent,Federal Question,"May 28, 2020",Marianne B. Bowler
381,"Russo v. Medallia, Inc. (1:21-cv-07681)","District Court, S.D. New York","Oct. 26, 2022, 1 a.m.",Naomi Reice Buchwald,"Russo v. Medallia, Inc., 1:21-cv-07681, (S.D.N.Y.)","Sept. 14, 2021","Nov. 9, 2021",Plaintiff,https://www.courtlistener.com/docket/60384507/1/russo-v-medallia-inc/,15:78m(a) Securities Exchange Act,850 Securities/Commodities,Federal Question,"Nov. 10, 2021",
382,United States v. SEALED (2:20-mj-03581),"District Court, C.D. California","Oct. 18, 2022, 12:25 p.m.",,"United States v. SEALED, 2:20-mj-03581, (C.D. Cal.)","July 30, 2020","Oct. 26, 2020",,,,,,"Oct. 26, 2020",
383,"J.B. Hunt Transport, Inc. v. Pyramid Moving Inc. (2:22-cv-02457)","District Court, D. Kansas","Sept. 12, 2023, 1:25 p.m.",Holly Lou Teeter,"J.B. Hunt Transport, Inc. v. Pyramid Moving Inc., 2:22-cv-02457, (D. Kan.)","Nov. 9, 2022","Sept. 11, 2023",None,https://www.courtlistener.com/docket/65743790/1/jb-hunt-transport-inc-v-pyramid-moving-inc/,18:1964 Racketeering (RICO) Act,470 Racketeer/Corrupt Organization,Diversity,,Kenneth G. Gale
384,Waligunda v. Mandel (1:22-cv-01393),"District Court, E.D. Virginia","Dec. 8, 2022, 5:38 a.m.",Rossie David Alston Jr.,"Waligunda v. Mandel, 1:22-cv-01393, (E.D. Va.)","Dec. 6, 2022","Dec. 6, 2022",Plaintiff,https://www.courtlistener.com/docket/66615162/1/waligunda-v-mandel/,28:1332 Diversity-Fraud,370 Other Fraud,Diversity,,Ivan D. Davis
385,"Wang v. Tesla, Inc. (1:20-cv-03040)","District Court, E.D. New York","Jan. 2, 2023, 5:08 a.m.",Nicholas Garaufis,"Wang v. Tesla, Inc., 1:20-cv-03040, (E.D.N.Y)","July 8, 2020","Oct. 4, 2022",Plaintiff,https://www.courtlistener.com/docket/17330909/1/wang-v-tesla-inc/,28:1332 Diversity-Fraud,190 Contract: Other,Diversity,"Oct. 4, 2022",Sanket J. Bulsara
386,"Hufnus v. DoNotPay, Inc. (3:20-cv-08701)","District Court, N.D. California","May 2, 2023, 10 a.m.",Vince Girdhari Chhabria,"Hufnus v. DoNotPay, Inc., 3:20-cv-08701, (N.D. Cal.)","Dec. 9, 2020","June 24, 2021",Plaintiff,https://www.courtlistener.com/docket/18727949/1/hufnus-v-donotpay-inc/,47:227 Restrictions of Use of Telephone Equipment,485 Telephone Consumer Protection Act (TCPA),Federal Question,"June 24, 2021",
387,Sleep Number Corporation v. Young (0:20-cv-01507),"District Court, D. Minnesota","Feb. 28, 2023, 12:09 p.m.",Nancy Ellen Brasel,"Sleep Number Corporation v. Young, 0:20-cv-01507, (D. Minnesota)","July 2, 2020","Feb. 28, 2023",Both,https://www.courtlistener.com/docket/17367371/1/sleep-number-corporation-v-young/,28:1332 Diversity-Breach of Contract,190 Contract: Other,Diversity,,Elizabeth Cowan Wright
388,PROTECT THE PUBLIC'S TRUST v. U.S. DEPARTMENT OF COMMERCE (1:22-cv-02699),"District Court, District of Columbia","Oct. 27, 2023, 9:24 a.m.",Beryl Alaine Howell,"PROTECT THE PUBLIC'S TRUST v. U.S. DEPARTMENT OF COMMERCE, 1:22-cv-02699, (D.D.C.)","Sept. 7, 2022","Oct. 27, 2023",None,https://www.courtlistener.com/docket/64973176/1/protect-the-publics-trust-v-us-department-of-commerce/,05:552 Freedom of Information Act,895 Freedom of Information Act,U.S. Government Defendant,,
389,Chardon Dubos v. Biden Jr. (3:23-cv-01138),"District Court, D. Puerto Rico","Nov. 27, 2023, 10:17 a.m.",Silvia Carreno-Coll,"Chardon Dubos v. Biden Jr., 3:23-cv-01138, (D.P.R.)","March 22, 2023","Nov. 27, 2023",Plaintiff,https://www.courtlistener.com/docket/67073319/1/chardon-dubos-v-biden-jr/,Civil Miscellaneous Case,890 Other Statutory Actions,U.S. Government Defendant,,
390,"Dwelling Management Inc. v. Mission 8, LLC (1:23-cv-02593)","District Court, S.D. New York","Aug. 23, 2023, 4:11 p.m.",Valerie Elaine Caproni,"Dwelling Management Inc. v. Mission 8, LLC, 1:23-cv-02593, (S.D.N.Y.)","March 27, 2023","Aug. 22, 2023",Plaintiff,https://www.courtlistener.com/docket/67096011/1/dwelling-management-inc-v-mission-8-llc/,15:1125 (a) False representation of goods sold in interstate commerce,840 Trademark,Federal Question,,
391,North Pointe Holdings Ltd (18-24659),"United States Bankruptcy Court, S.D. Florida.","July 5, 2023, 12:38 p.m.",A. Jay Cristol,"North Pointe Holdings Ltd, 18-24659, (Bankr. S.D. Florida)","Nov. 26, 2018","Jan. 13, 2023",,https://www.courtlistener.com/docket/8283503/1/north-pointe-holdings-ltd/,,,,"Jan. 11, 2023",
392,Oyler v. NFL Enterprises LLC (1:22-cv-08413),"District Court, S.D. New York","April 25, 2023, 7:54 a.m.",Lorna Gail Schofield,"Oyler v. NFL Enterprises LLC, 1:22-cv-08413, (S.D.N.Y.)","Oct. 3, 2022","Jan. 24, 2023",Plaintiff,https://www.courtlistener.com/docket/65394172/1/oyler-v-nfl-enterprises-llc/,28:1332fr Diversity-Fraud,Other Fraud,Diversity,"Jan. 25, 2023",
393,"Rady v. Boston Consulting Group, LLC (1:20-cv-02285)","District Court, S.D. New York","April 28, 2023, 4:31 p.m.",Andrew Lamar Carter Jr.,"Rady v. Boston Consulting Group, LLC, 1:20-cv-02285, (S.D.N.Y.)","March 13, 2020","Sept. 16, 2022",Plaintiff,https://www.courtlistener.com/docket/16970796/1/rady-v-boston-consulting-group-llc/,28:1338pt Patent Infringement,Patent,Federal Question,"Aug. 17, 2022",Barbara Moses
394,Oura Health Oy v. Circular SAS (6:22-cv-00478),"District Court, W.D. Texas","Nov. 28, 2023, 5:38 p.m.",Alan D. Albright,"Oura Health Oy v. Circular SAS, 6:22-cv-00478, (W.D. Tex.)","May 11, 2022","Nov. 28, 2023",Plaintiff,https://www.courtlistener.com/docket/63304026/1/oura-health-oy-v-circular-sas/,35:271 Patent Infringement,830 Patent,Federal Question,,
395,Isakina v. ReAlpha Tech Corp (2:21-cv-05901),"District Court, S.D. Ohio","Nov. 27, 2023, 9:08 a.m.",Michael H. Watson,"Isakina v. ReAlpha Tech Corp, 2:21-cv-05901, (S.D. Ohio)","Dec. 27, 2021","Nov. 27, 2023",Both,https://www.courtlistener.com/docket/61643888/1/isakina-v-realpha-tech-corp/,28:1332 Diversity - Stockholders Suits,Stockholders Suits,Diversity,,Chelsey M. Vascura
396,"Galois, Inc. v. SP Global, Inc. (1:22-cv-00166-PTG-JFA)","District Court, E.D. Virginia","July 14, 2023, 4:34 a.m.",Patricia Tolliver Giles,"Galois, Inc. v. SP Global, Inc., 1:22-cv-00166-PTG-JFA, (E.D. Va.)","Feb. 16, 2022","Aug. 10, 2022",Plaintiff,https://www.courtlistener.com/docket/63251569/1/galois-inc-v-sp-global-inc/,28:1332 Diversity-Contract Dispute,Other Fraud,Diversity,,John F. Anderson
397,Medallia Inc. v. Content Square SAS (6:21-cv-00532),"District Court, W.D. Texas","July 13, 2023, 9:50 a.m.",Alan D. Albright,"Medallia Inc. v. Content Square SAS, 6:21-cv-00532, (W.D. Tex.)","May 26, 2021","Feb. 9, 2023",Both,https://www.courtlistener.com/docket/59938661/1/medallia-inc-v-content-square-sas/,35:271 Patent Infringement,830 Patent,Federal Question,"Feb. 9, 2023",
398,"Meta Platforms, Inc. v. BrandTotal Ltd. (3:20-cv-07182)","District Court, N.D. California","July 3, 2023, 12:44 p.m.",Joseph Spero,"Meta Platforms, Inc. v. BrandTotal Ltd., 3:20-cv-07182, (N.D. Cal.)","Oct. 14, 2020","Oct. 5, 2022",Plaintiff,https://www.courtlistener.com/docket/18538482/1/meta-platforms-inc-v-brandtotal-ltd/,28:1331 Fed. Question,890 Other Statutory Actions,Federal Question,"Oct. 5, 2022",
399,"Wilhelm v. Conformis, Inc. (1:23-cv-00863)","District Court, D. Delaware","Sept. 20, 2023, 3:18 p.m.",,"Wilhelm v. Conformis, Inc., 1:23-cv-00863, (D. Del.)","Aug. 8, 2023","Sept. 20, 2023",Plaintiff,https://www.courtlistener.com/docket/67674835/1/wilhelm-v-conformis-inc/,15:78m(a) Securities Exchange Act,850 Securities/Commodities,Federal Question,,
